{
  "tool": "Optuna",
  "status": "tested",
  "added_value": true,
  "detail": "Discovery-selected pattern=slow_momentum_12_1, horizon=40d; held-out validation available=True",
  "best_discovery_mean": 0.0125012964452218,
  "validation_mean": 0.0140510298609663,
  "validation_win_rate": 0.4591849510156812,
  "validation_observations": 63898
}
[I 2026-10-07 14:21:58,535] A new study created in memory with name: no-name-6e1dd7f2-ca04-4ce4-8446-847fe03ec61f
[I 2026-10-07 14:21:58,536] Trial 0 finished with value: -0.0010634002887811 and parameters: {'pattern': 'range_expansion_reversal', 'horizon': 40}. Best is trial 0 with value: -0.0010634002887811.
[I 2026-10-07 14:21:58,536] Trial 1 finished with value: -0.0230812595133665 and parameters: {'pattern': 'panic_reversal_volume', 'horizon': 20}. Best is trial 0 with value: -0.0010634002887811.
[I 2026-10-07 14:21:58,537] Trial 2 finished with value: -0.0075933355276992 and parameters: {'pattern': 'wyckoff_spring_strict', 'horizon': 20}. Best is trial 0 with value: -0.0010634002887811.
[I 2026-10-07 14:21:58,537] Trial 3 finished with value: -0.0073384032249715 and parameters: {'pattern': 'range_expansion_reversal', 'horizon': 20}. Best is trial 0 with value: -0.0010634002887811.
[I 2026-10-07 14:21:58,538] Trial 4 finished with value: -0.0025724262555493 and parameters: {'pattern': 'reversal_bottom10', 'horizon': 20}. Best is trial 0 with value: -0.0010634002887811.
[I 2026-10-07 14:21:58,538] Trial 5 finished with value: -0.0073384032249715 and parameters: {'pattern': 'range_expansion_reversal', 'horizon': 20}. Best is trial 0 with value: -0.0010634002887811.
[I 2026-10-07 14:21:58,539] Trial 6 finished with value: 0.0042365975394188 and parameters: {'pattern': 'volatility_contraction_breakout', 'horizon': 20}. Best is trial 6 with value: 0.0042365975394188.
[I 2026-10-07 14:21:58,539] Trial 7 finished with value: -0.0025724262555493 and parameters: {'pattern': 'reversal_bottom10', 'horizon': 20}. Best is trial 6 with value: 0.0042365975394188.
[I 2026-10-07 14:21:58,540] Trial 8 finished with value: 0.001528080394706 and parameters: {'pattern': 'momentum_60_uptrend', 'horizon': 5}. Best is trial 6 with value: 0.0042365975394188.
[I 2026-10-07 14:21:58,540] Trial 9 finished with value: 0.0010112530053945 and parameters: {'pattern': 'relative_strength_20', 'horizon': 5}. Best is trial 6 with value: 0.0042365975394188.
[I 2026-10-07 14:21:58,541] Trial 10 finished with value: 0.0041395012960024 and parameters: {'pattern': 'volatility_contraction_breakout', 'horizon': 40}. Best is trial 6 with value: 0.0042365975394188.
[I 2026-10-07 14:21:58,542] Trial 11 finished with value: 0.0013471119056548 and parameters: {'pattern': 'volatility_contraction_breakout', 'horizon': 10}. Best is trial 6 with value: 0.0042365975394188.
[I 2026-10-07 14:21:58,543] Trial 12 finished with value: 0.0041395012960024 and parameters: {'pattern': 'volatility_contraction_breakout', 'horizon': 40}. Best is trial 6 with value: 0.0042365975394188.
[I 2026-10-07 14:21:58,544] Trial 13 finished with value: 0.0042365975394188 and parameters: {'pattern': 'volatility_contraction_breakout', 'horizon': 20}. Best is trial 6 with value: 0.0042365975394188.
[I 2026-10-07 14:21:58,544] Trial 14 finished with value: 0.0042365975394188 and parameters: {'pattern': 'volatility_contraction_breakout', 'horizon': 20}. Best is trial 6 with value: 0.0042365975394188.
[I 2026-10-07 14:21:58,545] Trial 15 finished with value: 0.0027235310839693 and parameters: {'pattern': 'relative_reversal_bottom20', 'horizon': 10}. Best is trial 6 with value: 0.0042365975394188.
[I 2026-10-07 14:21:58,546] Trial 16 finished with value: -0.0001585203873984 and parameters: {'pattern': 'volatility_contraction_breakout', 'horizon': 5}. Best is trial 6 with value: 0.0042365975394188.
[I 2026-10-07 14:21:58,547] Trial 17 finished with value: -0.0072184569903885 and parameters: {'pattern': 'wyckoff_spring_sos', 'horizon': 20}. Best is trial 6 with value: 0.0042365975394188.
[I 2026-10-07 14:21:58,547] Trial 18 finished with value: 0.0042365975394188 and parameters: {'pattern': 'volatility_contraction_breakout', 'horizon': 20}. Best is trial 6 with value: 0.0042365975394188.
[I 2026-10-07 14:21:58,548] Trial 19 finished with value: 0.0026693818163075 and parameters: {'pattern': 'pullback_in_uptrend', 'horizon': 10}. Best is trial 6 with value: 0.0042365975394188.
[I 2026-10-07 14:21:58,549] Trial 20 finished with value: 0.0011661548553849 and parameters: {'pattern': 'slow_momentum_12_1', 'horizon': 5}. Best is trial 6 with value: 0.0042365975394188.
[I 2026-10-07 14:21:58,549] Trial 21 finished with value: 0.0042365975394188 and parameters: {'pattern': 'volatility_contraction_breakout', 'horizon': 20}. Best is trial 6 with value: 0.0042365975394188.
[I 2026-10-07 14:21:58,550] Trial 22 finished with value: -0.0088468085129218 and parameters: {'pattern': 'wyckoff_spring', 'horizon': 20}. Best is trial 6 with value: 0.0042365975394188.
[I 2026-10-07 14:21:58,551] Trial 23 finished with value: 0.0009161742474102 and parameters: {'pattern': 'breakout_plus_volume', 'horizon': 20}. Best is trial 6 with value: 0.0042365975394188.
[I 2026-10-07 14:21:58,551] Trial 24 finished with value: 0.002450856887503 and parameters: {'pattern': 'relative_strength_20', 'horizon': 20}. Best is trial 6 with value: 0.0042365975394188.
[I 2026-10-07 14:21:58,552] Trial 25 finished with value: 0.0058859560530767 and parameters: {'pattern': 'slow_momentum_12_1', 'horizon': 20}. Best is trial 25 with value: 0.0058859560530767.
[I 2026-10-07 14:21:58,553] Trial 26 finished with value: 0.0058859560530767 and parameters: {'pattern': 'slow_momentum_12_1', 'horizon': 20}. Best is trial 25 with value: 0.0058859560530767.
[I 2026-10-07 14:21:58,554] Trial 27 finished with value: 0.0058859560530767 and parameters: {'pattern': 'slow_momentum_12_1', 'horizon': 20}. Best is trial 25 with value: 0.0058859560530767.
[I 2026-10-07 14:21:58,554] Trial 28 finished with value: 0.0058859560530767 and parameters: {'pattern': 'slow_momentum_12_1', 'horizon': 20}. Best is trial 25 with value: 0.0058859560530767.
[I 2026-10-07 14:21:58,555] Trial 29 finished with value: 0.0029492270165616 and parameters: {'pattern': 'slow_momentum_12_1', 'horizon': 10}. Best is trial 25 with value: 0.0058859560530767.
[I 2026-10-07 14:21:58,556] Trial 30 finished with value: 0.0125012964452218 and parameters: {'pattern': 'slow_momentum_12_1', 'horizon': 40}. Best is trial 30 with value: 0.0125012964452218.
[I 2026-10-07 14:21:58,557] Trial 31 finished with value: 0.0125012964452218 and parameters: {'pattern': 'slow_momentum_12_1', 'horizon': 40}. Best is trial 30 with value: 0.0125012964452218.
[I 2026-10-07 14:21:58,557] Trial 32 finished with value: 0.0125012964452218 and parameters: {'pattern': 'slow_momentum_12_1', 'horizon': 40}. Best is trial 30 with value: 0.0125012964452218.
[I 2026-10-07 14:21:58,558] Trial 33 finished with value: 0.0125012964452218 and parameters: {'pattern': 'slow_momentum_12_1', 'horizon': 40}. Best is trial 30 with value: 0.0125012964452218.
[I 2026-10-07 14:21:58,559] Trial 34 finished with value: 0.0125012964452218 and parameters: {'pattern': 'slow_momentum_12_1', 'horizon': 40}. Best is trial 30 with value: 0.0125012964452218.
[I 2026-10-07 14:21:58,560] Trial 35 finished with value: -0.0135249264030205 and parameters: {'pattern': 'panic_reversal_volume', 'horizon': 40}. Best is trial 30 with value: 0.0125012964452218.
[I 2026-10-07 14:21:58,560] Trial 36 finished with value: -0.0148967794404133 and parameters: {'pattern': 'wyckoff_spring', 'horizon': 40}. Best is trial 30 with value: 0.0125012964452218.
[I 2026-10-07 14:21:58,561] Trial 37 finished with value: -0.0138953066106825 and parameters: {'pattern': 'wyckoff_spring_strict', 'horizon': 40}. Best is trial 30 with value: 0.0125012964452218.
[I 2026-10-07 14:21:58,562] Trial 38 finished with value: -0.0110142845470753 and parameters: {'pattern': 'wyckoff_spring_sos', 'horizon': 40}. Best is trial 30 with value: 0.0125012964452218.
[I 2026-10-07 14:21:58,562] Trial 39 finished with value: 0.0125012964452218 and parameters: {'pattern': 'slow_momentum_12_1', 'horizon': 40}. Best is trial 30 with value: 0.0125012964452218.
[I 2026-10-07 14:21:58,563] Trial 40 finished with value: 0.0117762754849475 and parameters: {'pattern': 'momentum_60_uptrend', 'horizon': 40}. Best is trial 30 with value: 0.0125012964452218.
[I 2026-10-07 14:21:58,564] Trial 41 finished with value: 0.0125012964452218 and parameters: {'pattern': 'slow_momentum_12_1', 'horizon': 40}. Best is trial 30 with value: 0.0125012964452218.
[I 2026-10-07 14:21:58,565] Trial 42 finished with value: 0.0037182864309138 and parameters: {'pattern': 'breakout_plus_volume', 'horizon': 40}. Best is trial 30 with value: 0.0125012964452218.
[I 2026-10-07 14:21:58,565] Trial 43 finished with value: 0.0076003983219375 and parameters: {'pattern': 'relative_reversal_bottom20', 'horizon': 40}. Best is trial 30 with value: 0.0125012964452218.
[I 2026-10-07 14:21:58,566] Trial 44 finished with value: 0.0125012964452218 and parameters: {'pattern': 'slow_momentum_12_1', 'horizon': 40}. Best is trial 30 with value: 0.0125012964452218.
[I 2026-10-07 14:21:58,567] Trial 45 finished with value: 0.0059421786958453 and parameters: {'pattern': 'pullback_in_uptrend', 'horizon': 40}. Best is trial 30 with value: 0.0125012964452218.
[I 2026-10-07 14:21:58,568] Trial 46 finished with value: 0.0100537681623408 and parameters: {'pattern': 'relative_strength_20', 'horizon': 40}. Best is trial 30 with value: 0.0125012964452218.
[I 2026-10-07 14:21:58,568] Trial 47 finished with value: -5.825807982958879e-05 and parameters: {'pattern': 'reversal_bottom10', 'horizon': 40}. Best is trial 30 with value: 0.0125012964452218.
